insight_id;timestamp;region;country;insight_desc;1;2025-11-23;All;Bangladesh;Bangladesh’s button and linen sectors face repeated infrastructure damage from tropical storms and flash floods, causing power outages and transport bottlenecks that threaten timely order fulfillment.
;2025-11-24;All;All;;2.0;2025-11-23;All;Bangladesh;Recent factory fire at a nylon weaving plant and failed safety inspections at Padma Textile have sparked worker strikes, highlighting heightened occupational‑health risks for Bangladeshi exporters.
;2025-11-24;All;All;;3.0;2025-11-23;All;Bangladesh;Bangladeshi firms lead ESG progress: Rajshahi adopts on‑site solar, AI traceability, chemical‑free pre‑treatment, coconut‑husk fibers, and patented textile‑waste separation, positioning them for greener market access.
;2025-11-24;All;All;;4.0;2025-11-23;All;Italy;Italy has introduced stricter quality inspections for Bangladeshi cotton imports, increasing clearance times and logistics costs for exporters and demanding higher compliance standards.
;2025-11-24;All;All;;5.0;2025-11-23;All;Bangladesh;Padma Textile’s uncontrolled release of finishing chemicals, inability to process offcuts, and postponed renewable‑energy conversion expose significant environmental compliance gaps for Bangladeshi supply chains.
1.0;2025-11-23;All;India;India’s textile output is repeatedly disrupted by extreme weather, power rationing, chemical accidents, and transport security incidents, causing delays in nylon, denim dyeing, linen logistics, and zipper component deliveries.;;;;;
2.0;2025-11-23;All;India;Indian suppliers face mounting ESG scrutiny after labor‑abuse embargoes, false certification fines, groundwater contamination lawsuits, illegal waste piling notices, and delayed boiler upgrades, raising compliance and reputational risks for buyers.;;;;;
3.0;2025-11-23;All;Multiple;"Trade policies tighten across Asia: Japan lifts silk quotas but adds countervailing duties on Thai polyester yarn and button labeling;Italy tightens nylon and buckle inspections;the UK grants tariff‑free buckles from Indonesia;Germany adds sustainability tariffs on uncertified nylon.";;;;;
4.0;2025-11-23;All;Multiple;"Vietnam and China accelerate circular‑economy moves—Vietnam cuts denim export taxes, adopts digital product passports, pineapple‑leaf fibre, closed‑loop dyeing and expands textile recycling;China pushes DPPs, water‑saving laser denim, recycling funds, yet faces labor and green‑claim scandals.";;;;;
5.0;2025-11-23;All;Multiple;Labor unrest and civil disruptions in Bangladesh and Vietnam—button and buckle plant strikes, flood‑induced power outages, factory fires, and transport blockades—are repeatedly interrupting production and logistics, urging diversified sourcing and risk buffers.;;;;;
1.0;2025-11-23;All;Multiple;"Rising trade barriers across key markets: Japan adds countervailing duties on Thai polyester yarn;India imposes export duty on cotton;UK threatens tariffs on Chinese linen;Italy tightens nylon customs;Germany enforces sustainability tariffs on nylon, increasing cost and lead‑time volatility.";;;;;
2.0;2025-11-23;All;Multiple;Widespread labor unrest and civil protests are halting production and logistics: Thailand cotton‑spinning walkout, Bangladesh garment strike, India port blockades, Pakistan union stoppage, Sri Lanka student protests, Indonesia bridge collapse, causing delays and inventory shortages.;;;;;
3.0;2025-11-23;All;Multiple;"Natural disasters are repeatedly disrupting manufacturing and transport: South Korea typhoon halted zipper factories;Japan heatwave forced nylon power cuts;Vietnam typhoon delayed buckle exports;Indonesia monsoon floods stalled linen shipments;India heatwave caused power rationing;China earthquake paused denim lines.";;;;;
4.0;2025-11-23;All;Multiple;"Sustainability compliance is tightening: Germany imposes nylon sustainability tariffs;France mandates cotton origin labeling;Italy enforces quality checks on Bangladeshi cotton;UK sets new environmental benchmarks for Vietnamese buckles;China requires digital product passports, increasing audit and certification burdens.";;;;;
5.0;2025-11-23;All;Multiple;"Business conduct and corruption risks are surfacing: China faces multiple scandals (Fujian mis‑declaration, Shandong bribery, Chengdu kickbacks);India’s Delhi Apparel banned for duty‑drawback fraud;Bangladesh’s Padma Textile cited for labor safety and illegal waste;Thailand’s Bangkok Textile fined for tax evasion.";;;;;
1.0;2025-11-23;All;India;Severe heatwaves, dust storms, fog and power rationing are repeatedly throttling nylon, silk and linen production in India, exposing supply volatility and raising cost risks for downstream manufacturers.;;;;;
2.0;2025-11-23;All;India;Chemical explosions, port crane failures, rail blockades, tunnel closures and terrorist attacks are disrupting dye supplies and delaying shipments of denim, polyester and silk from India, tightening lead times and inventory buffers.;;;;;
3.0;2025-11-23;All;India;India’s temporary cotton export duty, higher zipper import tariffs and an anti‑subsidy probe on nylon imports are tightening trade margins, prompting buyers to reassess sourcing strategies and cost structures.;;;;;
4.0;2025-11-23;All;India;Mumbai Textile Mills is driving ESG progress with a green loan for biomass boilers, traceability tags on silk, banana‑fiber yarn blends, electro‑chemical dyeing cutting water use 85%, and a new textile recycling sorting line.;;;;;
5.0;2025-11-23;All;India;Delhi Apparel faces an embargo, DGFT ban, fines for false cotton certifications, labor‑abuse lawsuits and environmental penalties, highlighting heightened governance and compliance risks for Indian textile suppliers.;;;;;
1.0;2025-11-23;All;Multiple;Japan, Italy, UK and other markets are tightening import rules—quotas on silk, countervailing duties on polyester yarn, new labeling for buttons, stricter customs checks on cotton, nylon and buckles—raising cost and lead‑time for sourcing key inputs.;;;;;
2.0;2025-11-23;All;Multiple;Widespread labor strikes and protests in Bangladesh, Thailand, India, Pakistan and Indonesia repeatedly block transport routes and halt factories, disrupting supply of cotton, zippers, buttons, polyester and denim across the region.;;;;;
3.0;2025-11-23;All;Multiple;Heatwaves in India, typhoons in Japan and South Korea, floods in Vietnam and Indonesia, and snow in South Korea have forced plant shutdowns and logistics delays, curbing production of nylon, silk, zipper and denim fabrics.;;;;;
4.0;2025-11-23;All;Multiple;Machinery failures, power outages and chemical accidents at facilities in China, India and Pakistan—spinning line breakdowns, power substation blackouts, dye plant explosions—have caused temporary shortages of polyester, nylon, dye chemicals and buckles.;;;;;
5.0;2025-11-23;All;Multiple;European and Chinese regulators are imposing sustainability tariffs, certification audits and anti‑subsidy duties on nylon, cotton and fasteners, while several firms face scandals over false claims, increasing compliance risk for sourced materials.;;;;;
1.0;2025-11-23;All;Bangladesh;Ongoing civil unrest and labor actions in Bangladesh are repeatedly halting transport routes and industrial parks, disrupting imports of buckles, silk garments, and polyester assembly lines.;;;;;
2.0;2025-11-23;All;Bangladesh;Severe weather events—tropical storm, flash floods, and a factory fire—have damaged critical infrastructure for button, linen, and nylon production, causing power outages and operational shutdowns.;;;;;
3.0;2025-11-23;All;Bangladesh;Bangladesh's leading textile firms (Rajshahi Silk & Dyeing) are accelerating sustainability, deploying solar power, AI traceability, upcycled coconut husk fibers, chemical‑free pre‑treatment, and patented fiber‑separation technology, raising ESG expectations for suppliers.;;;;;
4.0;2025-11-23;All;Italy;Importing nations are tightening standards on Bangladeshi textiles: Italy introduced stricter quality inspections for Bangladeshi cotton, potentially slowing clearance and raising logistics costs for exporters.;;;;;
5.0;2025-11-23;All;Multiple;Regional supply chain volatility from neighboring markets—Japan lifting silk quotas, China limiting polyester precursors, Germany imposing sustainability tariffs on nylon—could affect raw material availability for Bangladesh’s textile sector.;;;;;
1.0;2025-11-23;All;China;China’s new export controls—denim export limits, restrictions on high‑grade polyester precursors, and anti‑subsidy duties on metal buckles—are tightening supply and likely driving up raw material costs for downstream textile manufacturers.;;;;;
2.0;2025-11-23;All;China;Chinese producers are rolling out digital product passports, zero‑water dyeing and large‑scale chemical‑recycling programs, meaning buyers must demand verifiable sustainability certifications to maintain compliance and market access.;;;;;
3.0;2025-11-23;All;China;Recent infrastructure failures in China— a 48‑hour polyester spinning line shutdown and a regional power‑substation blackout affecting buckle manufacturing—highlight vulnerability to short‑term supply gaps.;;;;;
4.0;2025-11-23;All;Multiple;Japan’s countervailing duties on Thai polyester yarn, Italy’s stricter cotton inspections, and Germany’s sustainability tariffs on nylon illustrate a broader shift toward tighter trade and environmental standards for non‑Chinese inputs.;;;;;
5.0;2025-11-23;All;Multiple;Vietnam, India and Bangladesh are scaling alternative fibers—fungus‑derived, pineapple leaf, banana and coconut husk blends—offering sourcing diversification and lower environmental impact for eco‑focused brands.;;;;;
1.0;2025-11-23;All;Bangladesh;Bangladesh’s button, linen, nylon, and silk production faces repeated setbacks from a tropical storm, flash floods, a factory fire, and a tunnel closure, causing delays and higher logistics costs for exporters.;;;;;
2.0;2025-11-23;All;Bangladesh;A widespread labor union strike in Dhaka’s industrial parks halted up to 70% of scheduled cotton garment output, threatening supply reliability for international buyers.;;;;;
3.0;2025-11-23;All;Italy;Italy’s new cotton quality inspections for Bangladeshi imports impose stricter checks, extending clearance times and raising logistics expenses for Bangladesh exporters.;;;;;
4.0;2025-11-23;All;Multiple;China’s limits on polyester precursors and India’s heat‑wave‑driven nylon slowdown tighten global synthetic‑fiber supply, pressuring Bangladesh mills to seek alternative sources or face price hikes.;;;;;
5.0;2025-11-23;All;Bangladesh;Bangladeshi firms like Rajshahi are scaling solar power, AI‑driven traceability, and upcycled coconut‑husk fibers, offering buyers greener, certified material options aligned with ESG mandates.;;;;;
1.0;2025-11-23;All;Vietnam;Vietnam has imposed a temporary export ban on raw button materials and simultaneously cut export taxes on finished denim, creating supply constraints for button components while improving price competitiveness for denim exports.;;;;;
2.0;2025-11-23;All;Vietnam;Labor unrest is escalating: button assembly workers staged strikes over working hours, and safety‑related grievances triggered a partial strike at a major button factory, while fishermen protests have blocked polyester cargoes, risking production delays.;;;;;
3.0;2025-11-23;All;Vietnam;Transport bottlenecks emerged as a road accident halted zipper component deliveries and a typhoon damaged Vietnam’s coastal ports, delaying shipments of metal hardware and other textile accessories.;;;;;
4.0;2025-11-23;All;Vietnam;Vietnamese suppliers are advancing ESG practices: Hue Fabric & Thread launched digital product passports, integrated pineapple‑leaf fibre, achieved 98% dye‑water recovery, and expanded mechanical recycling capacity to 5,000 t/yr.;;;;;
5.0;2025-11-23;All;Vietnam;Compliance risk rises as Phu Quoc Textile faces union suppression allegations, false zero‑waste marketing, illegal discharge pits, deadstock mismanagement, and government warnings over high carbon intensity, signaling potential supplier reliability issues.;;;;;
1.0;2025-11-23;All;Vietnam;Vietnam is reshaping export policy: a temporary ban on raw button material exports, a cut in export tax on finished denim, and a new export duty on raw cotton, creating cost volatility and supply constraints for button, denim and cotton sourcing.;;;;;
2.0;2025-11-23;All;Vietnam;Labor unrest is rising: button factories faced a union strike over working hours and safety grievances, while fishermen protests blocked a polyester port, together causing production slow‑downs and shipment delays for key accessories.;;;;;
3.0;2025-11-23;All;Vietnam;Logistics bottlenecks emerged from a road accident halting zipper component deliveries, a typhoon shutting coastal ports and delaying buckle exports, and community blockades at a polyester hub, increasing lead times for Vietnam‑sourced accessories.;;;;;
4.0;2025-11-23;All;Vietnam;Vietnamese manufacturers are advancing sustainability: Hue Fabric adopts digital product passports, integrates pineapple‑leaf fibre, implements closed‑loop dye filtration and expands mechanical recycling, positioning Vietnam as a growing source of eco‑friendly textile inputs.;;;;;
5.0;2025-11-23;All;Vietnam;Regulatory scrutiny intensifies: Phu Quoc Textile faces export‑license suspension for false classifications, investigations into illegal rail payments, and government warnings over carbon intensity, highlighting compliance risk for Vietnamese suppliers.;;;;;
1.0;2025-11-23;All;Vietnam;Vietnam’s temporary export ban on raw button materials and a labor‑union strike at a major button assembly plant create immediate supply volatility for button components.;;;;;
2.0;2025-11-23;All;Vietnam;A July export‑tax cut on finished denim aims to boost Vietnam’s price competitiveness, yet German customs have intensified scrutiny of Vietnamese denim imports for misclassification, raising compliance risk.;;;;;
3.0;2025-11-23;All;Vietnam;Recent road accidents blocking zipper component deliveries and a typhoon‑induced port shutdown for buckle shipments have disrupted Vietnam’s outbound logistics, threatening on‑time delivery to buyers.;;;;;
4.0;2025-11-23;All;Vietnam;"The UK has introduced new sustainability benchmarks for Vietnamese buckle hardware imports, requiring verified environmental credentials;suppliers must adopt digital product passports and certify low‑impact production.";;;;;
5.0;2025-11-23;All;Vietnam;Vietnamese firms such as Hue Fabric are rolling out digital passports, pineapple‑leaf fibre yarns, closed‑loop dyeing and expanded recycling capacity, positioning the country for greener, traceable textile sourcing.;;;;;
1.0;2025-11-24;All;China;China restricts financing for high‑pollution cotton processing, slowing export growth.;;;;;
2.0;2025-11-24;All;China;Urumqi Cotton & Thread Co. expands organic cotton farms and adopts foam‑dyeing, boosting sustainable cotton supply.;;;;;
3.0;2025-11-24;All;China;Shandong Textile Supply Chain embroiled in child‑labor, false recycled‑content, and wastewater scandals, raising compliance risk for Chinese cotton vendors.;;;;;
4.0;2025-11-24;All;United States;"No recent US tariff adjustments specific to Chinese cotton;existing duty framework remains unchanged, keeping cost assumptions stable for US importers.";;;;;
5.0;2025-11-24;All;Multiple;Chinese textile firms deploy blockchain digital product passports and large‑scale recycling, signaling a shift toward traceable, circular cotton sourcing.;;;;;
1.0;2025-11-24;All;Japan;Japan is tightening trade measures: lifting silk import quotas while imposing temporary countervailing duties on Thai polyester yarn, creating rapid shifts in cost and availability for silk and polyester inputs.;;;;;
2.0;2025-11-24;All;Bangladesh;Widespread labor unrest in Bangladesh—industrial park strikes, transport blockades, and union actions—has repeatedly halted cotton and garment exports, forcing suppliers to seek alternative production hubs.;;;;;
3.0;2025-11-24;All;India;Severe heatwaves, power rationing, and a major chemical plant explosion in India have constrained nylon and dye supplies, leading to production slowdowns and higher material costs.;;;;;
4.0;2025-11-24;All;Germany;Germany’s new sustainability tariffs on nylon and mandatory origin labeling for cotton increase compliance costs, pushing buyers to verify certifications and consider lower‑risk sourcing regions.;;;;;
5.0;2025-11-24;All;China;Frequent operational disruptions in China—including polyester line breakdowns, power substation failures, and chemical leaks—create short‑term raw material shortages, demanding buffer inventories for downstream manufacturers.;;;;;
1.0;2025-11-24;All;Multiple;"Rising trade barriers across key markets: Japan imposed countervailing duties on Thai polyester yarn;India added export duties on cotton;Pakistan enforced a temporary cotton export ban;the UK announced retaliatory tariffs on Chinese linen;the US cut linen tariffs for Sri Lanka;China limited polyester precursor exports.";;;;;
2.0;2025-11-24;All;Multiple;"Widespread civil unrest is disrupting logistics: Bangladesh’s industrial‑park strike halted cotton exports;India’s port crane failure delayed zipper raw‑material arrivals;Thailand anti‑government protests slowed polyester export schedules;Pakistan protests blocked nylon transport routes;Sri Lanka unrest shut down a major zipper‑and‑buckle industrial park.";;;;;
3.0;2025-11-24;All;Multiple;"Natural disasters are causing material supply shocks: Japan’s typhoon halted zipper factories;South Korea’s typhoon paralyzed zipper production;Indonesia’s monsoon floods delayed linen shipments;Vietnam’s earthquake forced temporary evacuations at denim plants;Thailand’s floods disrupted linen logistics.";;;;;
4.0;2025-11-24;All;Multiple;"Sustainability compliance is tightening: Germany introduced nylon sustainability tariffs;France requires cotton origin labeling;Italy enforces stricter quality checks on Bangladeshi cotton;Vietnam’s Hue Co. launched digital product passports for cotton;China mandates DPP use across subsidiaries.";;;;;
5.0;2025-11-24;All;Multiple;"Business conduct risks are rising: Fujian Fabric Works faced tax incentive revocation for polyester blend mis‑declaration and bribery;Shandong Textile was implicated in child‑labor and false recycling claims;Delhi Apparel received an export ban for labor abuses;Bangkok Textile Group fined for import tax evasion.";;;;;
1.0;2025-11-24;South Asia;Multiple;India’s temporary cotton export duty, Pakistan’s ban on raw cotton exports, and Bangladesh’s labor‑strike‑driven cotton export slowdown are tightening outbound cotton supply across South Asia.;;;;;
2.0;2025-11-24;South Asia;India;India faces multiple supply shocks: heat‑wave‑induced power cuts curtail nylon output, a port crane failure delays zipper raw‑material off‑loading, and community protests block rail access to silk weaving clusters.;;;;;
3.0;2025-11-24;South Asia;India;Mumbai Textile Mills advances sustainability with a green biomass‑boiler loan, encrypted silk traceability tags, banana‑fiber yarn blends, 85% water‑saving electro‑chemical dyeing, and a new high‑capacity textile‑recycling sorting centre.;;;;;
4.0;2025-11-24;South Asia;Multiple;Labor unrest in Bangladesh halts 70% of cotton garment output, Pakistan’s union dispute stops nylon fabric production, and Indian community protests disrupt silk rail logistics, collectively threatening South Asian textile flow.;;;;;
5.0;2025-11-24;South Asia;Multiple;European and Japanese regulators are tightening compliance: France requires cotton origin labels, Germany adds sustainability tariffs on uncertified nylon, Italy enforces stricter nylon inspections, and Japan mandates button‑hardware labeling, pressuring South Asian exporters to upgrade certification and documentation.;;;;;
1.0;2025-11-24;All;Bangladesh;Widespread civil unrest and labor strikes in Bangladesh have blocked major transport routes and halted cotton and buckle production, risking delays for export orders.;;;;;
2.0;2025-11-24;All;Bangladesh;Tropical storms and flash floods in Bangladesh have damaged power lines and infrastructure supporting button and linen factories, causing outages and temporary shutdowns.;;;;;
3.0;2025-11-24;All;Bangladesh;A large fire destroyed a nylon weaving plant in Bangladesh, eliminating key production capacity and requiring months of reconstruction before supply can resume.;;;;;
4.0;2025-11-24;All;Bangladesh;Rajshahi Silk & Dyeing is committing to 100% on‑site solar power for new facilities and deploying AI‑driven raw silk traceability, signaling a shift toward greener, transparent sourcing in Bangladesh.;;;;;
5.0;2025-11-24;All;Multiple;Italy has introduced stricter quality inspections on Bangladeshi cotton imports, increasing customs processing times and logistics costs for Bangladesh exporters, highlighting rising non‑tariff barriers.;;;;;
1.0;2025-11-24;All;Bangladesh;Widespread civil unrest and labor strikes in Bangladesh are repeatedly halting transport routes and factory output, affecting cotton, buckles, polyester, and silk shipments.;;;;;
2.0;2025-11-24;All;Bangladesh;Recent tropical storms and flash floods have damaged power infrastructure and manufacturing facilities in Bangladesh, causing outages and delays for linen, button and other textile production.;;;;;
3.0;2025-11-24;All;Bangladesh;Bangladeshi suppliers, led by Rajshahi Silk & Dyeing, are advancing sustainability with on‑site solar power, AI traceability, upcycled coconut‑husk fibers, chemical‑free pre‑treatment, and patented fiber‑separation technology.;;;;;
4.0;2025-11-24;All;Bangladesh;Safety and compliance lapses at Padma Textile Co‑operative—including failed inspections, false ethical claims, hazardous finishing‑agent releases, and waste‑management failures—pose significant supplier risk for buyers.;;;;;
5.0;2025-11-24;All;Multiple;Importing markets are tightening scrutiny on Bangladeshi exports: Italy imposes stricter cotton quality checks, the UK grants tariff‑free buckles from Indonesia, while new labeling rules in Japan affect button hardware.;;;;;
1.0;2025-11-24;All;Bangladesh;Bangladesh’s textile export logistics face repeated disruptions from civil unrest and labor strikes, causing road blockages, tunnel closures, and delayed shipments of cotton, silk and metal buckles.;;;;;
2.0;2025-11-24;All;Bangladesh;Severe weather events—tropical storms and flash floods—have knocked out power and damaged facilities in Bangladesh, halting linen, button and other textile production lines.;;;;;
3.0;2025-11-24;All;Multiple;Importing nations tighten standards: Italy imposes stricter cotton inspections, Japan adds button labeling, and France mandates cotton origin labels, increasing compliance costs for Bangladeshi exporters.;;;;;
4.0;2025-11-24;All;Bangladesh;Bangladeshi producers are advancing sustainability: Rajshahi adopts on‑site solar, AI traceability, upcycled coconut‑husk fibers, chemical‑free pre‑treatments, and patented fiber‑separation tech, boosting green credentials.;;;;;
5.0;2025-11-24;All;Bangladesh;A major fire destroyed a nylon weaving plant in Bangladesh, eliminating equipment and inventory and creating a multi‑month recovery timeline, threatening supply reliability.;;;;;
1.0;2025-11-24;All;Italy;Italy has introduced stricter quality inspections on Bangladeshi cotton imports, slowing clearance and raising compliance costs for Bangladeshi suppliers.;;;;;
2.0;2025-11-24;All;Bangladesh;Tropical storms, flash floods and a factory fire in Bangladesh have damaged button, linen and nylon facilities, creating short‑term supply gaps and logistics delays.;;;;;
3.0;2025-11-24;All;Bangladesh;Widespread labor union strikes across Dhaka’s industrial parks halted roughly 70% of cotton garment output, threatening export commitments.;;;;;
4.0;2025-11-24;All;Bangladesh;Rajshahi Silk & Dyeing is scaling solar power, AI‑driven traceability, upcycled coconut‑husk fibers, chemical‑free pre‑treatment and patented fiber‑separation, positioning Bangladesh for ESG‑focused sourcing.;;;;;
5.0;2025-11-24;All;Japan;Japan has imposed new labeling rules for imported buttons and temporary countervailing duties on polyester yarn, increasing compliance burdens for global hardware and yarn suppliers.;;;;;
1.0;2025-11-24;All;Bangladesh;Bangladesh faces recurring natural disaster impacts: tropical storm damaged button production infrastructure (2024-10-08) and flash floods caused power outages in linen manufacturing (2024-11-07), highlighting vulnerability of key accessory and fabric lines.;;;;;
2.0;2025-11-24;All;Bangladesh;A major fire in December 2024 destroyed a large nylon weaving plant, wiping out equipment and inventory and requiring months for reconstruction, creating a significant supply gap for nylon yarn.;;;;;
3.0;2025-11-24;All;Bangladesh;Transport bottlenecks emerged in January 2025 when a safety‑driven road tunnel closure delayed silk garment shipments, exposing the fragility of Bangladesh’s export logistics for high‑value fabrics.;;;;;
4.0;2025-11-24;All;Bangladesh;Labor unions launched a widespread strike across Dhaka’s industrial parks in August 2024, halting up to 70% of scheduled cotton garment output and threatening cotton export reliability.;;;;;
